user_id,interest_summary,interaction_contents_1,interaction_contents_2,interaction_contents_3,interaction_contents_4,interaction_contents_5
D202210493,信息管理与应用专业，博士，研究型,"Title: Role of AI chatbots in education: systematic literature review
Abstract: AI chatbots shook the world not long ago with their potential to revolutionize education systems in a myriad of ways. AI chatbots can provide immediate support by answering questions, offering explanations, and providing additional resources. Chatbots can also act as virtual teaching assistants, supporting educators through various means. In this paper, we try to understand the full benefits of AI chatbots in education, their opportunities, challenges, potential limitations, concerns, and prospects of using AI chatbots in educational settings. We conducted an extensive search across various academic databases, and after applying specific predefined criteria, we selected a final set of 67 relevant studies for review. The research findings emphasize the numerous benefits of integrating AI chatbots in education, as seen from both students’ and educators’ perspectives. We found that students primarily gain from AI-powered chatbots in three key areas: homework and study assistance, a personalized learning experience, and the development of various skills. For educators, the main advantages are the time-saving assistance and improved pedagogy. However, our research also emphasizes significant challenges and critical factors that educators need to handle diligently. These include concerns related to AI applications such as reliability, accuracy, and ethical considerations.
Keywords: Systematic literature review, Artificial intelligence, AI chatbots, Chatbots in education
Journal: International Journal of Educational Technology in Higher Education","Title: AI student success predictor: Enhancing personalized learning in campus management systems
Abstract: Campus Management Systems (CMSs) are vital tools in managing educational institutions, handling tasks like student enrollment, scheduling, and resource allocation. The increasing adoption of CMS for online and mixed-learning environments highlights their importance. However, inherent limitations in conventional CMS platforms hinder personalized student guidance and effective identification of academic challenges. Addressing this crucial gap, our study introduces an AI Student Success Predictor empowered by advanced machine learning algorithms, capable of automating grading processes, predicting student risks, and forecasting retention or dropout outcomes. Central to our approach is the creation of a standardized dataset, meticulously curated by integrating student information from diverse relational databases. A Convolutional Neural Network (CNN) feature learning block is developed to extract the hidden patterns in the student data. This classification model stands as an ensemble masterpiece, incorporating SVM, Random Forest, and KNN classifiers, subsequently refined by a Bayesian averaging model. The proposed ensemble model shows the ability to predict the student grades, retention, and risk levels of dropout. The accuracy achieved by the proposed model is assessed using test data, culminating in a commendable 93% accuracy for student grade prediction and student risk prediction, and a solid 92% accuracy for the complex domain of retention and dropout forecasting. The proposed AI system seamlessly integrates with existing CMS infrastructure, enabling real-time data retrieval and swift, accurate predictions, enhancing academic decision-making efficiency. Our study’s pioneering AI Student Success Predictor bridges the chasm between traditional CMS limitations and the growing demands of modern education.
Keywords: Learning management system, Predictive analytics, Machine learning, AI-Driven educational systems, Student success prediction and educational technology
Journal: Computers in Human Behavior",,,
U202242880,专业: 信息管理与信息系统。兴趣: 数据分析、信息系统开发、信息管理。目标: 掌握Python、R、SQL。习惯: 定期复习、主动参与、设定计划、利用资源。,"Title: Attention Is All You Need
Abstract: The dominant sequence transduction models are based on complex recurrent or convolutional neural networks that include an encoder and a decoder. The best performing models also connect the encoder and decoder through an attention mechanism. We propose a new simple network architecture, the Transformer, based solely on attention mechanisms, dispensing with recurrence and convolutions entirely. Experiments on two machine translation tasks show these models to be superior in quality while being more parallelizable and requiring significantly less time to train. Our model achieves 28.4 BLEU on the WMT 2014 English-to-German translation task, improving over the existing best results, including ensembles, by over 2 BLEU. On the WMT 2014 English-to-French translation task, our model establishes a new single-model state-of-the-art BLEU score of 41.8 after training for 3.5 days on eight GPUs, a small fraction of the training costs of the best models from the literature. We show that the Transformer generalizes well to other tasks by applying it successfully to English constituency parsing both with large and limited training data.
Keywords: Attention Mechanisms, Transformer, Machine Translation
Journal: 31st Conference on Neural Information Processing Systems","Title: BERT: Pre-training of Deep Bidirectional Transformers for Language Understanding
Abstract: We introduce a new language representation model called BERT, which stands for Bidirectional Encoder Representations from Transformers. Unlike recent language representation models (Peters et al., 2018a; Radford et al., 2018), BERT is designed to pretrain deep bidirectional representations from unlabeled text by jointly conditioning on both left and right context in all layers. As a result, the pre-trained BERT model can be fine-tuned with just one additional output layer to create state-of-the-art models for a wide range of tasks, such as question answering and language inference, without substantial task-specific architecture modifications.BERT is conceptually simple and empirically powerful. It obtains new state-of-the-art results on eleven natural language processing tasks, including pushing the GLUE score to 80.5% (7.7% point absolute improvement), MultiNLI accuracy to 86.7% (4.6% absolute improvement), SQuAD v1.1 question answering Test F1 to 93.2 (1.5 point absolute improvement) and SQuAD v2.0 Test F1 to 83.1 (5.1 point absolute improvement).
Keywords: Computer Science, Artificial IntelligenceComputer Science, Interdisciplinary ApplicationsLinguistics
Journal: NAACL-HLT","Title: ImageNet Classification with Deep Convolutional Neural Networks
Abstract: We trained a large, deep convolutional neural network to classify the 1.2 million high-resolution images in the ImageNet LSVRC-2010 contest into the 1000 different classes. On the test data, we achieved top-1 and top-5 error rates of 37.5% and 17.0%, respectively, which is considerably better than the previous state-of-the-art. The neural network, which has 60 million parameters and 650,000 neurons, consists of five convolutional layers, some of which are followed by max-pooling layers, and three fully connected layers with a final 1000-way softmax. To make training faster, we used nonsaturating neurons and a very efficient GPU implementation of the convolution operation. To reduce overfitting in the fully connected layers we employed a recently developed regularization method called “dropout” that proved to be very effective. We also entered a variant of this model in the ILSVRC-2012 competition and achieved a winning top-5 test error rate of 15.3%, compared to 26.2% achieved by the second-best entry.
Keywords: ImageNet, Deep Convolutional Neural Networks, Classification
Journal: COMMUNICATIONS OF THE ACM","Title: Playing Atari with Deep Reinforcement Learning
Abstract: We present the first deep learning model to successfully learn control policies directly from high-dimensional sensory input using reinforcement learning. The model is a convolutional neural network, trained with a variant of Q-learning, whose input is raw pixels and whose output is a value function estimating future rewards. We apply our method to seven Atari 2600 games from the Arcade Learning Environment, with no adjustment of the architecture or learning algorithm. We find that it outperforms all previous approaches on six of the games and surpasses a human expert on three of them.
Keywords: Machine Learning
Journal: arXiv:1312.5602v1 [cs.LG] 19 Dec 2013",
U202243400,专业: 信息管理与信息系统。兴趣: 通过大模型识别与分类人类情绪。目标: 了解大模型基础知识与实现方式。习惯: 听学校课程、小红书网课、B站学习、CSDN和git了解代码与知识、综合知识实践。,"Title: ChatGPT 大语言模型的评论情感分类预测与主题识别研究 Abstract: 【Purpose/Significance】Explore public sentiment and main concerns about ChatGPT large language models, aiding AI companies in advancing AIGC technology and providing suggestions for government tech regulation. 【Method/Process】Crawl Weibo data, preprocess, build Bert model for sentiment classification, combine LDA topic clustering and ARIMA time series model to reveal public focus and sentiment towards ChatGPT, predict user sentiment trends. 【Result/Conclusion】Public attitudes towards ChatGPT vary, with balanced sentiment distribution. Main concerns show complexity, indicating positive expectations for ChatGPT and similar models in public acceptance and sentiment. 【Innovation/Limitation】Combining fine-grained sentiment comments with LDA topic clustering and ARIMA time series model breaks limitations of static sentiment analysis, providing in-depth analysis of public attitudes, concerns, and future expectations towards ChatGPT. Journal: Information Science",博客主题：ChatGPT 大语言模型的情感和关注点研究。方法：爬取微博数据，Bert情感分类，LDA主题聚类和ARIMA时间序列模型。结果：公众态度多样，关注点复杂，对ChatGPT未来持乐观态度。创新：细粒度情感评论和多角度分析。关键词：ChatGPT、机器学习、情感分析、主题聚类。期刊：计算机工程,Title: 基于图层级异构图注意力网络的 JavaScript 恶意代码检测 Abstract: 针对传统抽象语法树检测方法的局限性，提出基于图层级异构图注意力网络的 JavaScript 恶意代码检测方法。构建异构图提取框架，建模 JS 恶意代码的空间结构和数据依赖关系，丰富节点属性特征；改进异构图注意力网络结构，提高图表征能力。实验结果表明，方法在真实数据集上准确率超过99.2%。关键词：恶意代码检测、JavaScript、图神经网络。期刊：吉林大学学报(工学版),Title: 影视剧本 AI配音的情绪识别：发展现状、算法局限及改进建议 Abstract: 文本的语音生成技术在影视剧配音中应用广泛，但长文本情绪识别仍是难题。梳理情绪识别算法现状，分析不足之处，提出 AI情绪识别改进建议。引入“图式化”情感分析方法，解决多维度情感识别问题。关键词：AI配音、情绪识别、影视剧本。期刊：现代电影技术,Title: 自注意力机制混合神经网络脑电情绪分类算法 Abstract: 提出自注意力的混合神经网络分类算法用于脑电情绪分类。结合卷积神经网络、自注意力机制、残差连接和双向长短记忆，提高分类准确率。在公开数据集上表现优异，分类准确率达94.95%和96.75%。关键词：脑电情绪分类、混合神经网络、自注意力机制。期刊：天津理工大学学报
U202242760,专业: 大数据管理与应用。兴趣: 编程语言、机器学习、深度学习、数据分析。重要性: 通过计算机算力完成人力难以完成的任务。准确率: 高准确率的预测、分类任务。学习动力: 上课提高了对计算机相关内容的兴趣。,"Title: Pixel Recurrent Neural Networks
Abstract: Modeling the distribution of natural images is a landmark problem in unsupervised learning. This task requires an image model that is at once expressive, tractable and scalable. We present a deep neural network that sequentially predicts the pixels in an image along the two spatial dimensions. Our method models the discrete probability of the raw pixel values and encodes the complete set of dependencies in the image. Architectural novelties include fast twodimensional recurrent layers and an effective use of residual connections in deep recurrent networks. We achieve log-likelihood scores on natural images that are considerably better than the previous state of the art. Our main results also provide benchmarks on the diverse ImageNet dataset. Samples generated from the model appear crisp, varied and globally coherent.
Keywords: Pixel Recurrent Neural Networks; Image modeling; Unsupervised learning; Deep neural networks; Log-likelihood scores
Journal: arXiv:1601.06759v2 [cs.CV]","Title: Training Very Deep Networks
Abstract: Theoretical and empirical evidence indicates that the depth of neural networks is crucial for their success. However, training becomes more difficult as depth increases, and training of very deep networks remains an open problem. Here we introduce a new architecture designed to overcome this. Our so-called highway networks allow unimpeded information flow across many layers on information highways. They are inspired by Long Short-Term Memory recurrent networks and use adaptive gating units to regulate the information flow. Even with hundreds of layers, highway networks can be trained directly through simple gradient descent. This enables the study of extremely deep and efficient architectures.
Keywords: Highway networks; Deep neural networks; Information highways; Adaptive gating units; Training very deep networks
Journal: The Swiss AI Lab IDSIA / USI / SUPSI","Title: DRAW: A Recurrent Neural Network For Image Generation
Abstract: This paper introduces the Deep Recurrent Attentive Writer (DRAW) neural network architecture for image generation. DRAW networks combine a novel spatial attention mechanism that mimics the foveation of the human eye, with a sequential variational auto-encoding framework that allows for the iterative construction of complex images. The system substantially improves on the state of the art for generative models on MNIST, and, when trained on the Street View House Numbers dataset, it generates images that cannot be distinguished from real data with the naked eye.
Keywords: DRAW; Recurrent Neural Network; Image Generation; Attention Mechanism; Variational Auto-encoding
Journal: Proceedings of the 32nd International Conference on Machine Learning","Title: Deep Neural Networks are Easily Fooled: High Confidence Predictions for Unrecognizable Images
Abstract: Deep neural networks (DNNs) have recently been achieving state-of-the-art performance on a variety of pattern-recognition tasks, most notably visual classification problems. Given that DNNs are now able to classify objects in images with near-human-level performance, questions naturally arise as to what differences remain between computer and human vision. A recent study revealed that changing an image (e.g., of a lion) in a way imperceptible to humans can cause a DNN to label the image as something else entirely (e.g., mislabeling a lion a library). Here we show a related result: it is easy to produce images that are completely unrecognizable to humans, but that state-of-the-art DNNs believe to be recognizable objects with 99.99% confidence (e.g., labeling with certainty that white noise static is a lion). Specifically, we take convolutional neural networks trained to perform well on either the ImageNet or MNIST datasets and then find images with evolutionary algorithms or gradient ascent that DNNs label with high confidence as belonging to each dataset class. It is possible to produce images totally unrecognizable to human eyes that DNNs believe with near certainty are familiar objects, which we call ""fooling images"" (more generally, fooling examples). Our results shed light on interesting differences between human vision and current DNNs, and raise questions about the generality of DNN computer vision.
Keywords: Deep Neural Networks; Fooling Images; Evolutionary Algorithms; Gradient Ascent; Human Vision; Computer Vision
Journal: Computer Vision and Pattern Recognition (CVPR '15), IEEE","Title: Decaf: A Deep Convolutional Activation Feature for Generic Visual Recognition
Abstract: We evaluate whether features extracted from the activation of a deep convolutional network trained in a fully supervised fashion on a large, fixed set of object recognition tasks can be repurposed to novel generic tasks. Our generic tasks may differ significantly from the originally trained tasks and there may be insufficient labeled or unlabeled data to conventionally train or adapt a deep architecture to the new tasks. We investigate and visualize the semantic clustering of deep convolutional features with respect to a variety of such tasks, including scene recognition, domain adaptation, and fine-grained recognition challenges. We compare the efficacy of relying on various network levels to define a fixed feature, and report novel results that significantly outperform the state-of-the-art on several important vision challenges. We are releasing DeCAF, an open-source implementation of these deep convolutional activation features, along with all associated network parameters to enable vision researchers to be able to conduct experimentation with deep representations across a range of visual concept learning paradigms.
Keywords: Deep Convolutional Activation Feature; Generic Visual Recognition; Domain Adaptation; Fine-grained Recognition; Scene Recognition
Journal: arXiv:1310.1531v1 [cs.CV]"
