user_id,interest_summary,interaction_contents_1,interaction_contents_2,interaction_contents_3,interaction_contents_4,interaction_contents_5
U202242844,一、大数据管理与应用: 海量数据的收集、存储、处理、分析和应用。技术和方法广泛，包括数据挖掘、机器学习、数据可视化。数据已成为企业决策、市场分析、科学研究等重要资源。二、学习兴趣: 对数据科学的热爱、技术创新的追求、解决实际问题的好奇。不断学习新技术和方法。三、学习目标: 掌握数据处理技能、理解数据分析方法、提升数据可视化能力。不断调整学习目标以适应变化的需求。四、学习习惯: 定期学习保持连续性和系统性，主动学习提高效率，深入思考加深对知识的理解和应用。,"Title:Enhancing personalized learning: AI-driven identification of learning stylesand content modification strategies
    Journal:International Journal of Cognitive Computing in Engineering
    Abstract:In the rapidly advancing era of educational technology, customized learning materials have the potentialto enhance individuals’ learning capacities. This research endeavors to devise an effective method fordetecting a learner’s preferred learning style and subsequently adapting the learning content to align withthat style, utilizing artificial intelligence AI techniques. Our investigation finds that analyzing learners’ webtracking logs for activity classification and categorizing individual responses for feedback classification arehighly effective methods for identifying a learner’s learning styles, such as visual, auditory, and kinesthetic.A custom dataset has been constructed in this research comprising approximately 506 samples and 22features utilizing the Moodle learning management system (LMS), successfully categorizing students intotheir respective learning styles. Furthermore, decision tree, random forest, support vector machine (SVM),logistic regression, XGBoost, blending ensemble, and convolutional neural network (CNN) algorithms withcorresponding optimized hyperparameters and synthetic minority oversampling technique (SMOTE) have beenapplied for learning behavior classification. The blending ensemble technique with the XGBoost meta-learningmodel accomplished the best performance for learning style detection with an accuracy of 97.56%. Next, thetext content of the electronic documents is modified by employing different natural language processing (NLP)techniques, including named entity recognition of spaCy, knowledge graph, generative pre-trained transformer3 (GPT-3), and text-to-text transfer transformer (T5) model, to accommodate diverse learning styles. Variousapproaches, such as color coding, audio scripts, mind maps, flashcards, etc., are implemented to adapt thecontent effectively for the detected categories of learners. The spaCy NLP-based named entity recognition(NER) model demonstrates a 94.16% F1 score and 0.92 exact match ratio for color coding text generation often electronic documents comprising 790 distinct individual words. These modifications aim to cater to theunique preferences of learners, fostering a more personalized and engaging educational experience. To the bestof our knowledge, this is the first time an integrated learning style detection and content modification systemhas been developed in this work utilizing efficient AI techniques and a private dataset.
    Keywords:Blending ensemble technique,Content modification,Learning style detection,Named entity recognition,Text-to-text transfer transformer (T5) model","Title:Implementing the Dynamic Feedback-Driven LearningOptimization Framework: A Machine Learning Approach to Personalize Educational Pathways
    Journal:Applied Sciences
    Abstract:This study introduces a novel approach named the Dynamic Feedback-Driven LearningOptimization Framework (DFDLOF), aimed at personalizing educational pathways through machinelearning technology. Our findings reveal that this framework significantly enhances student engagementand learning effectiveness by providing real-time feedback and personalized instructional contenttailored to individual learning needs. This research demonstrates the potential of leveraging advancedtechnology to create more effective and individualized learning environments, offering educators a newtool to support each student’s learning journey. The study thus contributes to the field by showcasinghow personalized education can be optimized using modern technological advancements.
    Keywords: machine learning; personalized education; adaptive learning systems; online learningplatforms; educational data analysis","Title:Exploring the Impact of Artificial Intelligence in Teaching and Learning of Science: A Systematic Review of Empirical Research
    Journal:Research in Science Education
    Abstract:The use of Artificial Intelligence (AI) in education is transforming various dimensions ofthe education system, such as instructional practices, assessment strategies, and adminis-trative processes. It also plays an active role in the progression of science education. Thissystematic review attempts to render an inherent understanding of the evidence-basedinteraction between AI and science education. Specifically, this study offers a consolidatedanalysis of AI’s impact on students’ learning outcomes, contexts of its adoption, students’and teachers’ perceptions about its use, and the challenges of its use within science edu-cation. The present study followed the PRISMA guidelines to review empirical paperspublished from 2014 to 2023. In total, 74 records met the eligibility for this systematicstudy. Previous research provides evidence of AI integration into a variety of fields inphysical and natural sciences in many countries across the globe. The results revealedthat AI-powered tools are integrated into science education to achieve various pedagogi-cal benefits, including enhancing the learning environment, creating quizzes, assessingstudents’ work, and predicting their academic performance. The findings from this paperhave implications for teachers, educational administrators, and policymakers.
    Keywords:AI Artificial intelligence,Science education,Engineering students,STEM learning ,Science learning","Title:The Impact of Artificial Intelligence on Higher Education: An Empirical Study
    Journal:European Journal of Educational Sciences
    Abstract:Artificial intelligence (AI) has been a topic of growing interest and investigation in various fields, including higher education. This research article explores the impact of AI on higher education by examining its effects on teaching and learning, assessment, ethics, required skills, and future careers. The aim of this study is to analyse the influence of AI on higher education, investigate its impact on the teaching and learning process, examine its effect on assessment and grading, and predict its influence on graduates' future careers. To accomplish this, the study employs a qualitative approach based on a survey of the higher education audience. The results of this study demonstrate the crucial role of AI in the future of higher education. The findingshighlight the effectiveness and efficiency of AI in equipping graduates with new skills for their future careers. They also emphasise the importance of considering the ethical implications of AI. The study reveals that higher education institutions need to integrate AI more extensively in their programs to prepare graduates for the future workforce.
    AI has the potential to revolutionize education by personalizing teaching methods to suit individual student needs, providing prompt feedback, and automating administrative tasks. It can also assist in grading and assessment, freeing educators to focus on developing curriculum and providing quality instruction. The study findings suggest that AI has a positive impact on the learning experience by facilitating the acquisition of new knowledge and skills. This research provides insights into the potential of AI to transform higher education and contribute to the development of new skills for graduates. It has important implications for educators, policy-makers, and other stakeholders in the higher education sector. The study findings suggest that AI should be more extensively integrated into higher education curricula, and that institutions need to consider the ethical implications of AI in the development and implementation of their programs. By doing so, they can better prepare graduates for the demands of the future workforce.
    Keywords: AI; Higher education; impact; learning & teaching","Title:Integrating Artificial Intelligence in Education: Impacts on Student Learning and Innovation
    Journal:International Journal of Vocational Education and Training Research
    Abstract:This study explores the implementation of artificial intelligence (AI) in an educational context and its impact on data-driven decision-making related to student engagement, academic success, and creativity. Contextually, considering the necessity of utilization AI tools in education as a predominant factor in educational practice, this research provides full-fledged knowledge and approach on the overall implementation and significance of AI tools using hypothetical situation evidence (background materials), which are required to understand their prominence. We use a mixed-methods approach, combining quantitative analysis of institutional records and surveys capturing student engagement, academic performance and innovative thinking pre-post AI implementation with qualitative case studies which provide detailed insights into how AI tools can be implemented effectively in educational settings. This study is based on secondary data source, major publications available in the Scopus database related to AI in education. Search terms for data search were ""Artificial Intelligence in Education,"" ""AI-driven tools,"" ""Impact of AI on classroom dynamics"", ""Personalized learning"", ""Educational technology, AI, and creativity in education"", Critical thinking in the classroom, Adaptive learning systems), intelligent tutoring systems)."" Student engagement. The results demonstrate significant gains in multiple metrics, with engagement scores increasing by 20–23%, GPA from 9% to 14%, and innovative thinking skills levels swelling from 44% to 57%. About 65%-75% of teacher surveys indicated a positive impact of AI on teaching and learning. The study also notes constraints including confounding whereby the inability to control for factors thatmay affect odds of innovative thinking and conceptualization in measuring innovative thinking. This is role, it should also advocate for longitudinal inquiries, establish standardized ways of assessing, and be analytical about the ethical implications raised by AI in education. Overall, this study underscores that AI has considerable potential to improve educational achievementand the necessity of systematic research in order to actualize its benefits. This study reinforces the possibility of AI making a big difference in improving educational results. As such, it illuminates the importance of systematic investigations into AI′s function in education to obtain full knowledge on how best to take advantage.
    Keywords:Artificial Intelligence, Education, Student Engagement, Learning Outcomes, Innovation"
U202260010,专业: 大数据221。兴趣: 人工智能、数据分析。目标: 掌握人工智能核心技术，结合大数据专业。习惯: 多种方式巩固知识、主动学习前沿技术。,"Title: Role of Deep Reinforcement Learning in Visual Navigation: A Review
Journal: Computer Engineering and Applications
Abstract: Traditional visual navigation methods heavily rely on high-precision maps, leading to inevitable error accumulation issues in complex dynamic environments. Deep reinforcement learning-based visual navigation methods simulate human navigation, enabling safe navigation to specified targets directly based on visual information in an end-to-end manner. This paper discusses the latest research issues in deep reinforcement learning visual navigation, summarizes important methods from data utilization, strategy optimization, and scene generalization perspectives over the past five years, and provides thoughts on current research status and future research directions in this field.","博客主题：基于人工智能深度挖掘的5A级旅游景区空间意象研究
期刊：《园林》
摘要：数字时代背景下人工智能技术的发展拓宽了数据的获取渠道。以5A级旅游景区为研究对象，利用官方平台的名录及属性数据和ChatGPT深度合成的文本数据挖掘隐性知识，采用描述性及推断性数理统计方法识别旅游景区关键空间意象要素，分析先天条件及后天干预与空间意象之间的关系。结果表明：（1）标志物是游客印象中区别不同景区的主要依据，也是个体景区获得较高游客意象评价的关键；（2）标志物、区域和道路构成5A级景区整体空间意象的基础和主体；（3）后天设计对意象的影响至关重要，标志物打造和区域划分是后天设计环节中的重点。旨在可促进景区规划设计提升及高质量发展，推动精细化形象宣传和管理。
关键词：旅游景区；空间意象；提示词设计；人工智能；数理统计","Title: Analysis of AI and Big Data-Driven Motor Vehicle Emission Monitoring System
Journal: China Environmental Monitoring
Abstract: The use of motor vehicle emission monitoring platforms as the main technical means of regulation is increasingly adopted by domestic environmental management departments, effectively improving environmental management efficiency. However, with the development of information technology and increasing management requirements, issues such as high labor costs, low data utilization rates, and information silos have gradually emerged. To address the characteristics of modern urban motor vehicle pollution management, an integrated AI and big data-driven 'sky, land, and car' monitoring system is proposed. By leveraging AI technologies such as machine learning and intelligent recognition, the system transforms the demands of motor vehicle pollution management at the city scale into big data scenarios, reducing manual inputs and enhancing management efficiency.","Title: Insights into the Application of AI-Driven Intelligent Traditional Chinese Medicine Diagnosis and Treatment Techniques
Journal: World Chinese Medicine
Abstract: With the continuous accumulation of extensive clinical data in traditional Chinese medicine, intelligent auxiliary diagnosis and treatment technologies have flourished, covering various aspects of clinical diagnosis and treatment. However, the application of research results in intelligent traditional Chinese medicine diagnosis and treatment is not optimistic, with slow progress in the analysis of traditional Chinese diagnostic aspects such as identification of syndromes. To promote the application of intelligent traditional Chinese medicine diagnosis and treatment techniques, this paper analyzes driving factors for promoting the application of AI technology, providing insights for the effective layout of research results before widespread application.","Title: Logic and Collaborative Governance of Security Risks in AI-Driven Text-to-Video Technology
Journal: Journal of Beijing Police College
Abstract: In the era of artificial intelligence, AI text-to-video technology, with its powerful natural language processing and image generation capabilities, has made new breakthroughs in technology innovation, application scenarios, and user experience. However, it also brings new security risks to data collection, processing, storage, and application ends. These security risks have unique logical generation mechanisms, which can be analyzed and explained from three dimensions: technology, law, and practice. To effectively prevent and respond to security risks, a collaborative governance path for AI text-to-video technology security risks is proposed, including shifting from a development-centric to a balanced development and security-oriented ideology, establishing a complete legal system and regulatory framework, enhancing the security and robustness of system models, and strengthening public risk awareness and prevention capabilities."
U202143246,专业: 物联网工程。兴趣: 数据内容查询算法、项目主平台系统搭建。目标: 深耕计算机领域、提升自我。,"Title: CATAPULT: Data-driven Selection of Canned Patterns for Efficient Visual Graph Query Formulation
Abstract: Visual graph query interfaces widen the reach of graph querying frameworks by enabling non-programmers to use them. Catapult presents a data-driven approach to select canned patterns, improving query efficiency. Experimental study shows Catapult's superiority over traditional techniques.","Title: Potential Identity Resolution Systems for the IIoT: A Survey
Abstract: IIoT connects sensors, equipment, products, and staff in factories. This article surveys potential identity resolution systems for IIoT, comparing their ability to meet IIoT requirements and technology selection.","Title: FastRAG: Retrieval Augmented Generation for Semi-structured Data
Abstract: FastRAG is designed for semi-structured data processing, integrating text search with KG querying. It provides accurate question answering, improving time and cost efficiency compared to existing methods.","Title: Retrieval Augmented Generation (RAG) and Beyond: A Comprehensive Survey on How to Make your LLMs use External Data More Wisely
Abstract: This survey categorizes RAG tasks, discusses challenges in deploying data-augmented LLMs, and proposes solutions for integrating external data effectively.","Title: Call Me When Necessary: LLMs can Efficiently and Faithfully Reason over Structured Environments
Abstract: Readi framework enables LLMs to reason over structured environments efficiently. Experimental results show Readi's effectiveness in surpassing previous methods and boosting vanilla LLMs."
U202242809,相比于信管是深入学习代码的一个学科，融合了计算机科学、统计学、管理学等多方面的知识。学习分析复杂数据集，对各行业涌现的海量数据有重要作用。数据挖掘充满魅力，探索海量数据背后隐藏的模式与关联。实用性的反馈，知识可快速应用于实际场景。深入掌握Python、R等数据分析语言，学习SQL数据库操作，理解数据挖掘算法原理与机器学习基础。多方面学习，明确发展路径，以兴趣驱动、目标导向、良好习惯保障，提升专业素养，迈向大数据领域前沿。,"Title: Design of Dish Automatic Recognition and Settlement Device Based on AI Visual Technology Abstract: This paper designs a dish automatic recognition and settlement device based on artificial intelligence visual technology to improve efficiency and user experience in the catering industry. The self-service AI smart dining table uses high-performance image data acquisition device and image processing unit in hardware to ensure rapid response and stability. In software, dishes are quickly and accurately identified through machine vision algorithms, orders are generated and transmitted to the payment end for automatic settlement. Sales data can be connected to cloud-based big data analysis. Compared to traditional ordering and settlement methods, this device provides a more convenient way of settlement, reduces manual operations, minimizes calculation errors, and helps with precise operations. Experimental results show that the device performs well in different environments, significantly improving restaurant service quality and efficiency. Keywords: Artificial Intelligence; Machine Vision; Faster R-CNN; Automatic Recognition and Settlement; Hardware Design; Image Processing Journal: Internet of Things Technologies","Title: Application and Prospect of Artificial Intelligence in Aortic Diseases Abstract: Aortic diseases have a sudden onset, poor clinical prognosis, and increasing incidence, posing a significant threat to human health. The aorta can affect the body's branch blood vessels, leading to complex pathophysiological mechanisms, making comprehensive evaluation of clinical multidimensional data a hot topic in aortic disease research. With the rapid development of information technology, artificial intelligence (AI) has the potential to achieve precise diagnosis and personalized treatment of aortic diseases, with applications in aortic disease imaging data analysis, aortic blood flow assessment, and disease prognosis risk prediction. This paper comprehensively reviews the application of AI in aortic disease analysis and discusses the new changes AI technology may bring to aortic disease diagnosis and treatment. Keywords: Artificial Intelligence; Machine Learning; Aortic Diseases Journal: Journal of Air Force Medical University","Title: Application Analysis of Artificial Intelligence in Chromosome Aberration Recognition Abstract: Improper exposure to ionizing radiation may lead to biological effects such as chromosome aberrations, posing a potential threat to human health. Image processing of chromosome images is crucial for diagnosis. With the advancement of science and technology, deep learning algorithms have significantly improved the accuracy of image segmentation and classification. This paper comprehensively reviews the application progress of artificial intelligence, especially deep learning technology, in chromosome aberration image analysis, comparing research status domestically and internationally. It discusses the challenges and future development directions of AI in chromosome aberration analysis, aiming to provide references for improving the accuracy and efficiency of chromosome aberration analysis. Keywords: Artificial Intelligence; Deep Learning; Ionizing Radiation; Chromosome Aberration; Chromosome Image Journal: Journal of Occupational Health and Emergency Rescue","Title: Research Progress of Artificial Intelligence in Ultrasound Diagnosis of Lymph Node Lesions Abstract: Lymphadenopathy is a common manifestation of various diseases, and judging the benign or malignant nature of lymph nodes is crucial for disease diagnosis and treatment. Ultrasound is currently the preferred imaging examination method for lymph node diseases, but distinguishing atypical lymph nodes from ultrasound images remains challenging. With the rapid development of artificial intelligence, deep learning and radiomics methods can provide more information that the naked eye cannot capture, and have been applied in ultrasound medical research of lymph nodes. Keywords: Artificial Intelligence; Ultrasound; Lymph Nodes; Deep Learning; Radiomics Journal: Journal of Imaging Research and Medical Applications","Title: Application of Artificial Intelligence in Synthetic Biology from a Patent Perspective Abstract: [Purpose] This study explores the application trends and distribution characteristics of artificial intelligence in synthetic biology through patent analysis, providing practical references and theoretical support for technological innovation, research directions, and industrial layout in this field. [Method] The study outlines the research content and methods of synthetic biology, deeply explores the development trend of artificial intelligence in the field of synthetic biology through patent network analysis combined with literature analysis. [Result] By retrieving and analyzing relevant patent data, the study reveals the application and publication trends of artificial intelligence in the field of synthetic biology, as well as the distribution of major countries and applicants. Furthermore, it analyzes the development of three technical branches: biosynthetic gene clusters, protein structure analysis, and transcription factor binding sites from a patent perspective. The study discusses the challenges faced by artificial intelligence in the application of synthetic biology and proposes some countermeasures. [Conclusion] The study helps to understand the technological development trajectory of artificial intelligence in the field of synthetic biology, providing references for the research and application of artificial intelligence technology in synthetic biology, emphasizing the importance of artificial intelligence technology in driving the development of the field and providing more innovative ideas and technical support for the national scientific and technological intelligence system, especially the development of synthetic biology. Keywords: Synthetic Biology; Artificial Intelligence; Patent Analysis; Technology Trends; Scientific Intelligence Journal: Acta Microbiologica Sinica"
U202242860,专业: 大数据管理与应用。兴趣: 大数据分析技能应用于各行各业、人类行为习惯和个性化需求研究。目标: 扎实掌握专业课程，兴趣转化为职业。习惯: 条理化学习、制定计划、专注听讲、实践结合理论、重视自学能力。,,,,,
