user_id,interest_summary,interaction_contents_1,interaction_contents_2,interaction_contents_3,interaction_contents_4,interaction_contents_5
U202242835,"专业：大数据管理与应用。兴趣：
- 智能推荐：改善信息获取，避免信息茧房。
- 人脸识别：提升识别精度，分析情绪，助力刑事侦查。
目标：了解感兴趣的技术，关注行业发展，分清技术利弊。
习惯：明确目标，自主学习与适当引导结合。","Title: Effort, Revenue, and Cost Sharing Mechanisms for Collaborative New Product Development
Abstract: New product innovation has long been a key avenue for revenue and profit growth, especially in industries such as life sciences and high technology. With lifetimes of products shrinking, technical complexity increasing, and daunting odds of success a norm, firms are forced to invest continually and ever-growing amounts to maintain their competitive edge. In response, some firms have looked beyond their four walls to manage the costs and risks of new product development (Quinn 2000). Pharmaceutical companies increasingly turn to each other and partner with specialist firms to develop new compounds that cost nearly a billion dollars to launch (Grover 1998). Articles trace HP’s development of its highly profitable printer business to joint work with suppliers during different phases of its business. Even companies with a strong patent portfolio and research budgets such as IBM have begun forging joint-development agreements to meet the challenges of contemporary products and markets (Austin American Statesman 2003). The increasing uncertainty, complexity of knowhow, and costs of product development and distribution require firms to pool their resources and enter into joint-development contracts involving the sharing of product revenues, development costs, and research and development (R&D) effort between industrial customers and suppliers, which forms the focus of this paper. Although intercompany alliance issues such as the melding of cultures have received a fair amount of research attention in the strategic management and organizational behavior literature (reviewed in the next section), the operational challenges of joint development are equally complex but relatively understudied. Unlike manufacturing and assembly, where activities can sometimes be outsourced in an arms-length transfer of prices and quantities, product development is an uncertain and long-lead-time activity with advance investments and joint work between firms that requires coordination about product features and qualities. In consolidating and converging industries such as high technology, firms may also fear that their partners may appropriate a large portion of the benefits. The classic product development challenges of managing technology and market uncertainty are coupled with agency issues stemming from opportunistic behavior of development partners. In this paper, we focus on a specific form of joint development between two firms that consider sharing the product revenues, development costs, and development effort. The product being developed is based on an uncertain underlying technology/science, and the firms could differ in their development capabilities as well as their power in the value chain. We now discuss the nuances of joint development in two of the industries that we studied.
Keywords: codevelopment; project alliances; product and supply chain innovation; technology uncertainty
Journal: Management Science","Title: Conceptualizing smart service systems
Abstract: Recent years have seen the emergence of physical products that are digitally networked with other products and with information systems to enable complex business scenarios in manufacturing, mobility, or healthcare. These “smart products”, which enable the co-creation of “smart service” that is based on monitoring, optimization, remote control, and autonomous adaptation of products, profoundly transform service systems into what we call “smart service systems”. In a multi-method study that includes conceptual research and qualitative data from in-depth interviews, we conceptualize “smart service” and “smart service systems” based on using smart products as boundary objects that integrate service consumers’ and service providers’ resources and activities. Smart products allow both actors to retrieve and to analyze aggregated field evidence and to adapt service systems based on contextual data. We discuss the implications that the introduction of smart service systems have for foundational concepts of service science and conclude that smart service systems are characterized by technology-mediated, continuous, and routinized interactions.
Keywords: Smart service . Smart products . Internet of things . Service science . Boundary object
Journal: Electron Markets","Title: A framework for AI-powered service innovation capability: Review and agenda for future research
Abstract: Artificial intelligence (AI)-powered service innovation (e.g., OpenAI’s ChatGPT, Google’s Bard and Microsoft’s Sydney) has become one of the most significant determinants of firms’ success in the Fourth Industrial Revolution. However, extant studies on this topic show that research studies hitherto have been ad-hoc, lacking a conceptual framework for the strategic management of AI-powered service innovation capability in dynamic markets. Thus, this study synthesises the current body of knowledge, proposes a framework, and develops an agenda to advance our knowledge. The findings reveal: (1) AI-market capability relates to customer orientation, industry orientation, and cross-functional orientation; (2) AI-infrastructure capability relates to data, business models, and ecosystem; and (3) AI-management capability relates to AI-orientation, organisational learning, and AI ethics which are crucial determinants of forming AI-powered service innovation capability. These capabilities for the strategic management of AI-powered service innovations play an essential role in achieving organizational agility and competitive advantage.
Keywords: AI-Powered service innovation, Innovation capability, AI market Capability, AI infrastructure Capability, AI management Capability, AI ethics, Organizational agility, Sustainable competitive advantage
Journal: Technovation","题目：基于深度学习的多视图立体视觉综述 摘要：多视图立体视觉在自动驾驶、增强现实、遗产保护和生物医学等领域得到广泛应用.为了弥补传统多视图立体视觉方法对低纹理区域不敏感、重建完整度差等不足,基于深度学习的多视图立体视觉方法应运而生.对基于深度学习的多视图立体视觉方法的开创性工作和发展现状进行综述,重点关注基于深度学习的多视图立体视觉局部功能改进和整体架构改进方法,深入分析代表性模型.同时,阐述目前广泛使用的数据集及评价指标,并对比现有方法在数据集上的测试性能.最后对多视图立体视觉未来有前景的研究发展方向进行展望. 关键词：深度学习;计算机视觉;三维重建;多视图立体视觉; 期刊：软件学报","题目：深度卷积神经网络在计算机视觉中的应用研究综述 摘要：随着大数据时代的到来,含更多隐含层的深度卷积神经网络(Convolutional neural networks,CNNs)具有更复杂的网络结构,与传统机器学习方法相比具有更强大的特征学习和特征表达能力。使用深度学习算法训练的卷积神经网络模型自提出以来在计算机视觉领域的多个大规模识别任务上取得了令人瞩目的成绩。本文首先简要介绍深度学习和卷积神经网络的兴起与发展,概述卷积神经网络的基本模型结构、卷积特征提取和池化操作。然后综述了基于深度学习的卷积神经网络模型在图像分类、物体检测、姿态估计、图像分割和人脸识别等多个计算机视觉应用领域中的研究现状和发展趋势,主要从典型的网络结构的构建、训练方法和性能表现3个方面进行介绍。最后对目前研究中存在的一些问题进行简要的总结和讨论,并展望未来发展的新方向。 关键词：深度学习;卷积神经网络;图像识别;目标检测;计算机视觉; 期刊：数据采集与处理"
U202260009,专业: 大数据管理与应用。兴趣: 数据挖掘、分析、技术架构、可视化。目标: 掌握Python、Java、R等编程语言，参与项目实践，提升竞争力。习惯: 理论与实践结合，定期学习与总结，广泛阅读专业书籍与论文。,"题目：人工智能时代未来学校研究
    期刊：华中师范大学博士学位论文
    摘要：进入 21 世纪，人工智能、大数据、云技术、生物技术等各项重大技术几乎在全球各个领域掀起了波澜壮阔的巨变，驱动着社会诸领域发生根本的变革。在教育领域，人工智能的全方位渗透激发了人们对未来学校的无限想象，更引发人们对未来学校的关注与热议。自从微软公司资助的“未来学校”在费城播下种子之后，以未来学校命名的会议、项目、计划迅速向全球蔓延开来，世界各国纷纷启动信息技术“重建”学校教育的行动。在此背景下，未来学校成为人工智能时代技术变革学校的重要趋势。本文正是立足于教育基本理论的立场，围绕着“如何理解并建构人工智能时代的未来学校?”这一核心问题所做的系统研究。全文除绪论以外共包含三部分共五章的内容，其中第一部分是本研究的前提，也是首章，提出未来学校是智能时代学校变革的应然方向。第二部分是本研究的主体，包括第二章、第三章、第四章，依次对未来学校的概念、价值和图景进行详细分析。第三部分是本研究的关键，也是最后一章，设计未来学校的建构方案。","题目：生成式人工智能赋能教育信息科学与技术研究：新机遇、新趋势、新议题
    期刊：《学术时空》
    摘要：生成式人工智能为教育创新变革注入了新动能，也为教育信息科学与技术研究带来了新契机。生成式人工智能引发的研究场域变化、分析手段革新、服务能力升级、实践样态变革，为教育研究的科学化发展带来了新机遇。在此背景下，教育信息科学与技术研究的目标和重点亟需发生转变，表现为从关注知识学习到重视创新人才培养，从重视规律挖掘到强调服务能力提升，从追求技术创新到注重解决教育问题，从聚焦通用场景到关注学科教育实践，从研究跟随实践到研究引领实践创新。为了更好地顺应生成式人工智能背景下教育信息科学与技术研究的新发展趋势，未来该领域研究应重点关注以下六大核心议题：一是面向创新人才培养的教育规律挖掘，二是学科教育人工智能大模型的构建与应用，三是学科素养图谱的智能生成与动态优化，四是素养导向的个性化学习服务关键技术，五是人机协同教育的实践创新和机理探索，六是人机协同胜任力的智能评测理论与技术。这些研究议题能为生成式人工智能背景下国家自然科学基金“教育信息科学与技术”资助方向的改革提供理论指引。","题目：教育科研新范式：人工智能驱动的教育科学研究*
    期刊：《教育研究》
    摘要：　范式的更迭与转换推动了科学变革。当前，人工智能立于科学变革潮头，给自然科学领域的科学发现与科研进步带来冲击，也为教育科研转型带来新机遇，有望在本体论、认识论、方法论和价值论维度影响教育研究，推动形成人工智能驱动的教育科学研究范式。该范式将通过提供强大的计算能力，为教育科研注入计算思维和技术基因，实现教育科研的底层理念之变；通过提升知识发现效率和释放科研人员生产力，推动构建人机混合增强的教育科研创新模式，实现教育科研的实践形式之变；通过强化多学科交叉融合和跨学科协作交流，促进形成交叉共融的教育科研组织体系，实现教育科研的组织生态之变。在此基础上，人工智能驱动的教育科学研究范式可以为教育分支学科或交叉学科的研究活动开辟新的思考向度与实践路径。未来，人们有望创造出人工智能与教育科研并行发展、双向赋能的新图景。但同时，为增强人工智能在教育科学中的积极影响力，人们必须应对算法创新与算法风险带来的挑战，让人工智能更好地驱动教育科学研究。","题目：人工智能赋能大学生思想政治教育研究
    期刊：山东师范大学博士学位论文
    摘要：以人工智能为代表的新一轮科技革命深度嵌入大学生的生活，改变了大学生的存在与认知方式、社会主流意识形态的形成与传播方式，对大学生思想政治教育的发生基础和存在样态产生了重要影响。习近平总书记提出要推动人工智能与教育深度融合，人工智能赋能大学生思想政治教育是其应有之义。在智能时代，推动人工智能赋能大学生思想政治教育是大学生思想政治教育高质量发展的必然选择。
    学界关于人工智能赋能大学生思想政治教育的研究主要有两种进路，一种是技术进路-种是社会进路，目前研究以技术进路为主，偏向于技术赋能应用的研究，研究的整体性和系统性有待于加强，理论研究存在视阈多元的问题，实践研究存在观点分散的问题，亟待将技术进路与社会进路统合起来整体把握，在理论与实践相结合中系统推进研究。本研究以马克思主义哲学为研究视域，系统探究人工智能赋能大学生思想政治教育的可能性和必要性、逻辑结构、价值目标、现实境况、理念创新、方法优化和路径选择问题，力求增强研究的整体性和系统性。","题目：教育学研究的热点与未来展望——基于2023年度人大复印报刊资料《教育学》转载论文的分析
    期刊：《教育研究》
    摘要：2023年度，人大复印报刊资料《教育学》转载论文来源广泛、栏目丰富，源杂志转载量较高的依次为《教育研究》、《华东师范大学学报（教育科学版）》、《教育研究与实验》等。文章第一作者所属单位性质以师范院校为主，高等学校仍处于绝对主体地位。教育学研究主要集中于新时代中国教育学学科建设研究、中国教育现代化研究、德育的现代危机与应对策略研究、知识价值观转变与教学范式研究、人工智能时代教育的发展路向研究、高质量教师教育体系建设研究、中国传统教育思想的现代意义研究、全球化时代比较教育的视域转向与方法论研究等八个热点问题。教育强国理论与政策研究，中国教育学自主知识体系建构研究，人才培养的战略性与创新性研究，新时代教育社会服务功能研究，学校教育、家庭教育和社会教育三位一体研究，人民教育家精神与中国特色教师教育体系研究，课程现代化与教材管理研究，技术赋能教育评价改革研究，加快推进教育数字化发展研究，高水平教育对外开放与国际影响力提升研究等十个问题将会是教育学研究未来一年关注的重点。"
